"Rol","Mensaje","Fecha"
"User","como puedo hacer para lanzar la excepcion que he creado una clase para ella en un constructor de otra clase","17:19:56 - 01/02/2025"
"semantic_search","# Departamento de Ingeniería Telemática  ## Excepciones  ### Programación de sistemas  **MATERIALES BASADOS EN EL TRABAJO DE DIVERSOS AUTORES:**   Carlos Alario Hoyos, Mª Carmen Fernández Panadero, Julio Villena Román  ### Excepciones  #### Qué son  - Eventos que afectan a la ejecución normal del programa (habitualmente errores). - Cuando ocurre una excepción, se crea un objeto `Exception` y se pasa al sistema de control de ejecución de Java. - El sistema de control de ejecución:   - Busca un fragmento de código que maneje dicha excepción recibida.   - Si no hay ningún código manejador, el programa termina con mensaje en consola.  #### Propósito  - Gestionar los errores de manera limpia y usando un flujo distinto. - Para agrupar y diferenciar entre sí distintos tipos de errores (como las excepciones son objetos, pueden agruparse en clases). - Cada método en Java debe:   - O capturar (`catch`)   - O lanzar (`throws`)   - Cualquier excepción que pueda producirse durante la ejecución.  #### Tipos  - Dos tipos principales:   - **Excepciones en tiempo de ejecución (`RuntimeException`):**     - No se comprueban en compilación.     - Ej: `NullPointerException`, `ArithmeticException`, `NumberFormatException`, `IndexOutOfBoundException`.   - **Excepciones comprobadas en compilación:**     - Ej: Excepciones de entrada/salida (`IOException`, `FileNotFoundException`, `EOFException`).     - Definidas por el usuario (`MyException`).     - En compilación, se comprueba que toda excepción (salvo las de tiempo de ejecución) se capture o se declare que el método puede lanzarla.  #### Uso  - Las excepciones ocurren:   - Implícitamente (cuando hay un error).   - Explícitamente: `throw new MyException(message)`. - Qué hacer:   - **Manejar la excepción:**     - Incluir en un bloque `try{}` las sentencias que puedan generar excepciones.     - Incluir en un bloque `catch(MyException e){}` las sentencias a ejecutar para manejar la excepción.   - **Lanzar la excepción (con declaración en el método):**     - `public void myMethod throws MyException`   - El bloque `finally{}` incluye el código que se ejecuta siempre para cualquier excepción.  #### Ejemplos  ```java try {      // Se ejecuta algo que puede producir una excepción  } catch (IOException e) {      // manejo de una excepción específica  } catch (Exception e) {      // manejo de una excepción cualquiera  } finally {      // código a ejecutar haya o no excepción  }   public int myMethod(int param) throws MyException {      if(param<0) throw new MyException(""Número negativo"");      int res = 10/param;      return res;  }  public class MyException extends Exception {        public MyException (String msg) {          super(msg);      }  }   public int myMethod(int param) throws MyException {      try {          int res = 10/param;          return res;      } catch(ArithmeticException e) {          throw new MyException(""División entre 0"");      }  }","17:19:56 - 01/02/2025"
"CharlieBOT","Para lanzar la excepción que has creado en una clase desde el constructor de otra clase, puedes seguir estos pasos:  Define tu propia excepción extendiendo la clase Exception. Por ejemplo:  public class MyException extends Exception {     public MyException(String msg) {         super(msg);     } }   En el constructor de la otra clase, puedes lanzar la excepción utilizando la sentencia throw seguida de una instancia de tu excepción. Por ejemplo:  public class OtraClase {     public OtraClase() throws MyException {         // ... (código del constructor)         if (/* alguna condición que requiere lanzar la excepción */) {             throw new MyException(""Mensaje de la excepción"");         }     } }  Al hacerlo de esta manera, cuando se cumpla la condición que requiere lanzar la excepción, se creará una instancia de MyException con el mensaje especificado y se lanzará esa excepción desde el constructor de OtraClase. Recuerda que, al lanzar una excepción en un constructor, debes declarar que el constructor puede lanzar esa excepción utilizando la cláusula throws en la firma del constructor, como se muestra en el ejemplo. Espero que esta explicación te sea de ayuda. Si necesitas más detalles o ejemplos específicos, no dudes en preguntar.","17:19:59 - 01/02/2025"
"User","no me funciona tiene q heredar o algo","17:24:09 - 01/02/2025"
"semantic_search","","17:24:09 - 01/02/2025"
"CharlieBOT","Sí, para poder lanzar una excepción en un constructor de una clase, la clase que contiene el constructor debe declarar que puede lanzar esa excepción utilizando la cláusula throws en la firma del constructor. Aquí tienes un ejemplo completo: public class MyException extends Exception {     public MyException(String msg) {         super(msg);     } }  public class OtraClase {     public OtraClase() throws MyException {         if (/* alguna condición que requiere lanzar la excepción */) {             throw new MyException(""Mensaje de la excepción"");         }     } }  En este ejemplo, la clase OtraClase declara que su constructor puede lanzar MyException utilizando throws MyException en la firma del constructor. Cuando se cumple la condición que requiere lanzar la excepción, se lanza una instancia de MyException con el mensaje especificado. Si sigues experimentando problemas, por favor proporciona más detalles o el código específico en el que estás trabajando para que pueda ayudarte de manera más precisa.","17:24:11 - 01/02/2025"
"User","si tengo que crear un objeto en otra clase que es main como puedo crearlo si ese objeto solo esta compuesto por un atributo","17:29:31 - 01/02/2025"
"semantic_search","","17:29:31 - 01/02/2025"
"CharlieBOT","Si necesitas crear un objeto de una clase en el método main de otra clase, y ese objeto solo tiene un atributo, puedes hacerlo de la siguiente manera en Java: Supongamos que tienes una clase llamada MiClase con un atributo nombre y un constructor que recibe el nombre como parámetro: public class MiClase {     private String nombre;      public MiClase(String nombre) {         this.nombre = nombre;     } }  Y en tu clase con el método main, puedes crear un objeto de MiClase de la siguiente manera: public class MainClass {     public static void main(String[] args) {         MiClase miObjeto = new MiClase(""Ejemplo"");         // Resto del código     } }  En este ejemplo, en el método main de la clase MainClass, se crea un objeto miObjeto de la clase MiClase pasando el nombre ""Ejemplo"" al constructor. Espero que esto responda tu pregunta. Si necesitas más ayuda, no dudes en preguntar.","17:29:34 - 01/02/2025"
"User","ese objeto tiene que coger una declaracion throws","17:30:52 - 01/02/2025"
"semantic_search","# Departamento de Ingeniería Telemática  ## Excepciones  ### Programación de sistemas  **MATERIALES BASADOS EN EL TRABAJO DE DIVERSOS AUTORES:**   Carlos Alario Hoyos, Mª Carmen Fernández Panadero, Julio Villena Román  ### Excepciones  #### Qué son  - Eventos que afectan a la ejecución normal del programa (habitualmente errores). - Cuando ocurre una excepción, se crea un objeto `Exception` y se pasa al sistema de control de ejecución de Java. - El sistema de control de ejecución:   - Busca un fragmento de código que maneje dicha excepción recibida.   - Si no hay ningún código manejador, el programa termina con mensaje en consola.  #### Propósito  - Gestionar los errores de manera limpia y usando un flujo distinto. - Para agrupar y diferenciar entre sí distintos tipos de errores (como las excepciones son objetos, pueden agruparse en clases). - Cada método en Java debe:   - O capturar (`catch`)   - O lanzar (`throws`)   - Cualquier excepción que pueda producirse durante la ejecución.  #### Tipos  - Dos tipos principales:   - **Excepciones en tiempo de ejecución (`RuntimeException`):**     - No se comprueban en compilación.     - Ej: `NullPointerException`, `ArithmeticException`, `NumberFormatException`, `IndexOutOfBoundException`.   - **Excepciones comprobadas en compilación:**     - Ej: Excepciones de entrada/salida (`IOException`, `FileNotFoundException`, `EOFException`).     - Definidas por el usuario (`MyException`).     - En compilación, se comprueba que toda excepción (salvo las de tiempo de ejecución) se capture o se declare que el método puede lanzarla.  #### Uso  - Las excepciones ocurren:   - Implícitamente (cuando hay un error).   - Explícitamente: `throw new MyException(message)`. - Qué hacer:   - **Manejar la excepción:**     - Incluir en un bloque `try{}` las sentencias que puedan generar excepciones.     - Incluir en un bloque `catch(MyException e){}` las sentencias a ejecutar para manejar la excepción.   - **Lanzar la excepción (con declaración en el método):**     - `public void myMethod throws MyException`   - El bloque `finally{}` incluye el código que se ejecuta siempre para cualquier excepción.  #### Ejemplos  ```java try {      // Se ejecuta algo que puede producir una excepción  } catch (IOException e) {      // manejo de una excepción específica  } catch (Exception e) {      // manejo de una excepción cualquiera  } finally {      // código a ejecutar haya o no excepción  }   public int myMethod(int param) throws MyException {      if(param<0) throw new MyException(""Número negativo"");      int res = 10/param;      return res;  }  public class MyException extends Exception {        public MyException (String msg) {          super(msg);      }  }   public int myMethod(int param) throws MyException {      try {          int res = 10/param;          return res;      } catch(ArithmeticException e) {          throw new MyException(""División entre 0"");      }  }","17:30:52 - 01/02/2025"
"CharlieBOT","Si estás creando un objeto de una clase que tiene un constructor que declara que puede lanzar una excepción, entonces cuando creas una instancia de esa clase, necesitas manejar esa excepción. Esto se aplica incluso si estás creando el objeto en el método main. Por ejemplo, si tu clase MiClase tiene un constructor que lanza una excepción, y estás creando un objeto de MiClase en el método main, necesitarás manejar esa excepción. Aquí tienes un ejemplo: Supongamos que la clase MiClase tiene un constructor que lanza una excepción MiException: public class MiClase {     public MiClase() throws MiException {         // Algo que puede lanzar MiException     } }  Entonces, al crear un objeto de MiClase en el método main, necesitarás manejar la excepción: public class MainClass {     public static void main(String[] args) {         try {             MiClase miObjeto = new MiClase();             // Resto del código         } catch (MiException e) {             // Manejo de la excepción MiException         }     } }  En este ejemplo, se utiliza un bloque try-catch para manejar la excepción MiException que puede ser lanzada al crear un objeto de MiClase. Espero que esto aclare tu duda. Si necesitas más ayuda, no dudes en preguntar.","17:30:55 - 01/02/2025"
"User","System.out.println(toString()); no me deja tostring es de otra clase","17:36:08 - 01/02/2025"
"semantic_search","","17:36:08 - 01/02/2025"
"CharlieBOT","Si estás intentando llamar al método toString() dentro de una clase y te está dando un error diciendo que toString es de otra clase, es posible que estés intentando llamar al método toString sin referenciar a un objeto específico. En Java, el método toString es un método de la clase Object que es la superclase de todas las clases en Java. Por lo tanto, todos los objetos heredan el método toString de la clase Object. Si estás dentro de un método de una clase y quieres llamar al método toString para imprimir una representación de tu propio objeto, debes llamar al método toString en una instancia específica de tu clase. Por ejemplo: public class MiClase {     private String atributo;      public MiClase(String atributo) {         this.atributo = atributo;     }      @Override     public String toString() {         return ""MiClase{atributo='"" + atributo + ""'}"";     }      public static void main(String[] args) {         MiClase objeto = new MiClase(""ejemplo"");         System.out.println(objeto.toString());     } }  En este ejemplo, la clase MiClase tiene un método toString que devuelve una representación en forma de cadena del objeto. Dentro del método main, se crea un objeto objeto de MiClase y se llama al método toString en esa instancia específica para imprimir su representación. Espero que esto te ayude a resolver tu problema. Si necesitas más ayuda, no dudes en preguntar.","17:36:12 - 01/02/2025"
"User","como se crea un metodo en una clase abstracta","17:47:51 - 01/02/2025"
"semantic_search","","17:47:51 - 01/02/2025"
"CharlieBOT","Para crear un método en una clase abstracta en Java, simplemente defines el método como lo harías en cualquier otra clase, pero usas la palabra clave abstract en la firma del método. Aquí tienes un ejemplo: public abstract class MiClaseAbstracta {     // Otros miembros de la clase      // Método abstracto     public abstract void miMetodoAbstracto();      // Otros métodos y miembros de la clase }  En este ejemplo, la clase MiClaseAbstracta contiene un método abstracto llamado miMetodoAbstracto. Al usar la palabra clave abstract en la firma del método, estás indicando que cualquier clase que herede de MiClaseAbstracta debe proporcionar una implementación concreta para el método miMetodoAbstracto. Cuando una clase hereda de MiClaseAbstracta, debe proporcionar una implementación para el método abstracto, de lo contrario, esa clase también debe ser declarada como abstracta. Aquí tienes un ejemplo de una clase que hereda de MiClaseAbstracta y proporciona una implementación para el método abstracto: public class MiClaseConcreta extends MiClaseAbstracta {     @Override     public void miMetodoAbstracto() {         // Implementación concreta del método abstracto         System.out.println(""Implementación del método abstracto en MiClaseConcreta"");     } }  En este ejemplo, la clase MiClaseConcreta hereda de MiClaseAbstracta y proporciona una implementación concreta para el método miMetodoAbstracto. Espero que esto aclare cómo se crea un método en una clase abstracta en Java. Si tienes más preguntas al respecto, no dudes en preguntar.","17:47:56 - 01/02/2025"
"User","el metodo de una clase abstracta puede no ser void","17:48:21 - 01/02/2025"
"semantic_search","","17:48:21 - 01/02/2025"
"CharlieBOT","Sí, en una clase abstracta, los métodos pueden tener cualquier tipo de retorno, no están limitados a ser void. Puedes definir métodos abstractos con cualquier tipo de retorno, incluyendo tipos primitivos, objetos, o incluso tipos genéricos. Aquí tienes un ejemplo de cómo definir un método abstracto con un tipo de retorno diferente de void en una clase abstracta: public abstract class MiClaseAbstracta {     // Método abstracto con un tipo de retorno diferente de void     public abstract int miMetodoAbstractoConRetorno(); }  En este ejemplo, la clase abstracta MiClaseAbstracta tiene un método abstracto llamado miMetodoAbstractoConRetorno que devuelve un entero (int). Cualquier clase que herede de MiClaseAbstracta debe proporcionar una implementación concreta para este método. Aquí tienes un ejemplo de una clase que hereda de MiClaseAbstracta y proporciona una implementación para el método abstracto con un tipo de retorno diferente de void: public class MiClaseConcreta extends MiClaseAbstracta {     @Override     public int miMetodoAbstractoConRetorno() {         // Implementación concreta del método abstracto con retorno         return 42;     } }  En este ejemplo, la clase MiClaseConcreta hereda de MiClaseAbstracta y proporciona una implementación concreta para el método miMetodoAbstractoConRetorno, devolviendo el valor 42. Espero que esto aclare que los métodos de una clase abstracta pueden tener un tipo de retorno diferente de void. Si tienes más preguntas al respecto, no dudes en preguntar.","17:48:26 - 01/02/2025"
"User","cuales son las particularidades de una clase abstarcta","17:49:24 - 01/02/2025"
"semantic_search","","17:49:24 - 01/02/2025"
"CharlieBOT","Las clases abstractas en Java tienen varias particularidades importantes:  No se pueden instanciar: No puedes crear instancias directas de una clase abstracta. Esto significa que no puedes hacer algo como MiClaseAbstracta objeto = new MiClaseAbstracta();. Sin embargo, puedes usar una clase abstracta como tipo de referencia para referenciar a un objeto de una clase concreta que herede de la clase abstracta.  Pueden contener métodos abstractos: Una clase abstracta puede contener métodos abstractos, es decir, métodos que no tienen implementación y cuya implementación debe ser proporcionada por las clases que heredan de la clase abstracta.  Pueden contener métodos concretos: Además de los métodos abstractos, una clase abstracta puede contener métodos concretos (es decir, métodos con implementación) y otros miembros de clase como campos, constructores, métodos estáticos, etc.  Pueden heredar de otra clase o de una sola clase abstracta: Una clase abstracta puede heredar de otra clase (abstracta o no) utilizando la palabra clave extends. Sin embargo, Java no admite la herencia múltiple de clases, por lo que una clase abstracta solo puede heredar de una sola clase (abstracta o concreta).  Pueden implementar interfaces: Al igual que las clases concretas, las clases abstractas pueden implementar interfaces.  Pueden ser parcialmente abstractas: Una clase abstracta puede tener algunos métodos concretos y otros métodos abstractos. Las clases concretas que heredan de la clase abstracta deben proporcionar implementaciones para los métodos abstractos y pueden optar por sobrescribir los métodos concretos si es necesario.   Estas son algunas de las particularidades más importantes de las clases abstractas en Java. Si tienes más preguntas sobre este tema o cualquier otro relacionado con la programación de sistemas, no dudes en preguntar.","17:49:28 - 01/02/2025"
"User","si una clase hereda de una abstracta que le pasan a los metodos de la clase que hereda","17:52:58 - 01/02/2025"
"semantic_search","","17:52:58 - 01/02/2025"
"CharlieBOT","Cuando una clase hereda de una clase abstracta, hereda todos los miembros de la clase abstracta, incluyendo los métodos concretos y los métodos abstractos. Aquí hay una explicación detallada de lo que hereda una clase que hereda de una clase abstracta:  Métodos concretos: La clase que hereda de la clase abstracta hereda todos los métodos concretos (es decir, los métodos con implementación) de la clase abstracta. Estos métodos concretos pueden ser utilizados directamente por la clase que hereda, o pueden ser sobrescritos si la clase que hereda necesita un comportamiento diferente para esos métodos.  Métodos abstractos: La clase que hereda de la clase abstracta hereda los métodos abstractos, pero debe proporcionar implementaciones concretas para estos métodos. Si la clase que hereda no proporciona implementaciones concretas para los métodos abstractos heredados, entonces esa clase también debe ser declarada como abstracta.  Campos y otros miembros de clase: La clase que hereda de la clase abstracta también hereda todos los campos y otros miembros de clase (como constructores, métodos estáticos, etc.) de la clase abstracta.   En resumen, cuando una clase hereda de una clase abstracta, hereda todos los miembros de la clase abstracta, pero debe proporcionar implementaciones concretas para los métodos abstractos heredados. Esto permite que la clase que hereda proporcione su propia implementación para los métodos concretos y abstractos según sea necesario. Si tienes más preguntas sobre la herencia de clases abstractas en Java, no dudes en preguntar.","17:53:02 - 01/02/2025"
"User","y si  no declara un metodo concreto","17:54:52 - 01/02/2025"
"semantic_search","","17:54:52 - 01/02/2025"
"CharlieBOT","Si una clase hereda de una clase abstracta y no proporciona una implementación concreta para un método concreto heredado, entonces esa clase debe ser declarada como abstracta. En otras palabras, si una clase hereda de una clase abstracta y no implementa todos los métodos abstractos heredados, entonces la clase que hereda también debe ser declarada como abstracta. Por ejemplo, si la clase abstracta ClaseAbstracta tiene un método concreto llamado metodoConcreto() y la clase que hereda de ClaseAbstracta no proporciona una implementación para metodoConcreto(), entonces la clase que hereda debe ser declarada como abstracta de la siguiente manera: public abstract class ClaseQueHereda extends ClaseAbstracta {     // No se proporciona implementación para metodoConcreto() }  En este caso, la clase ClaseQueHereda debe ser declarada como abstracta porque no proporciona una implementación concreta para todos los métodos concretos heredados de ClaseAbstracta. Es importante recordar que una clase abstracta no está obligada a proporcionar implementaciones para los métodos abstractos heredados de su superclase abstracta, pero cualquier clase concreta que herede de la clase abstracta debe proporcionar implementaciones concretas para todos los métodos abstractos heredados. Espero que esta explicación aclare tus dudas. Si necesitas más información sobre este tema o cualquier otro relacionado con la programación de sistemas, no dudes en preguntar.","17:54:56 - 01/02/2025"
"User","si una clase hereda de otrra clase un metodo ese metodo no va a hacer el mismo no?","18:26:39 - 01/02/2025"
"semantic_search","","18:26:39 - 01/02/2025"
"CharlieBOT","Cuando una clase hereda de otra clase y sobrescribe un método, la implementación en la clase hija puede ser diferente a la implementación en la clase padre. Esto se conoce como ""sobrescritura de método"" o ""override"" en programación orientada a objetos. Cuando una clase hija sobrescribe un método de la clase padre, la versión del método en la clase hija reemplaza la versión en la clase padre. Esto significa que cuando se llama al método en una instancia de la clase hija, se ejecutará la implementación definida en la clase hija en lugar de la implementación definida en la clase padre. Aquí hay un ejemplo sencillo en Java: class ClasePadre {     void metodoEjemplo() {         System.out.println(""Método de la clase padre"");     } }  class ClaseHija extends ClasePadre {     void metodoEjemplo() {         System.out.println(""Método de la clase hija"");     } }  En este ejemplo, la clase ClaseHija sobrescribe el método metodoEjemplo de la clase ClasePadre con una implementación diferente. Cuando se llama al método metodoEjemplo en una instancia de ClaseHija, se ejecutará la implementación definida en ClaseHija. Espero que esta explicación aclare tus dudas. Si necesitas más ejemplos o información adicional, no dudes en preguntar.","18:26:42 - 01/02/2025"
"User","si quiero usar en la clase hija el metodo de l clase padre deberia añadir el super:","18:27:29 - 01/02/2025"
"semantic_search","","18:27:29 - 01/02/2025"
"CharlieBOT","Exacto, si en la clase hija quieres llamar al método de la clase padre que has sobrescrito, puedes utilizar la palabra clave super para referirte a la implementación de la clase padre. Esto te permite acceder a la implementación de la clase padre desde la clase hija. Aquí tienes un ejemplo de cómo usar super en Java: class ClasePadre {     void metodoEjemplo() {         System.out.println(""Método de la clase padre"");     } }  class ClaseHija extends ClasePadre {     void metodoEjemplo() {         super.metodoEjemplo(); // Llamada al método de la clase padre         System.out.println(""Método de la clase hija"");     } }  En este ejemplo, al llamar super.metodoEjemplo() desde la clase hija, se ejecutará la implementación del método definida en la clase padre. Después de llamar al método de la clase padre, se ejecutará la implementación adicional definida en la clase hija. El uso de super es útil cuando necesitas extender la funcionalidad de un método de la clase padre en la clase hija, pero también quieres mantener la funcionalidad original del método de la clase padre. Espero que esta explicación te sea útil. Si tienes más preguntas sobre este tema o cualquier otro relacionado con la programación de sistemas, no dudes en preguntar.","18:27:33 - 01/02/2025"
"User","como puedo darle a un string el mismo contenido de otro string","18:36:16 - 01/02/2025"
"semantic_search","","18:36:16 - 01/02/2025"
"CharlieBOT","En Java, puedes asignar el contenido de un string a otro de varias maneras. Aquí tienes dos formas comunes de hacerlo:  Utilizando el operador de asignación (=):  String primerString = ""Hola""; String segundoString = primerString;  En este caso, el contenido de segundoString será ""Hola"", que es el mismo que el contenido de primerString.  Utilizando el método String#copyValueOf:  String primerString = ""Hola""; String segundoString = String.copyValueOf(primerString.toCharArray());  En este ejemplo, String.copyValueOf crea una nueva cadena con el mismo contenido que primerString. Ambos métodos logran el mismo resultado: asignar el contenido de un string a otro. Puedes elegir el que te resulte más conveniente en tu situación particular. Espero que esta información te sea útil. Si tienes más preguntas sobre Java o programación de sistemas, no dudes en preguntar.","18:36:19 - 01/02/2025"

