"Rol","Mensaje","Fecha"
"User","No entiendo bien la recursividad en Java. ¿Puedes explicarme el principio y darme un ejemplo?","19:42:19 - 06/02/2025"
"semantic_search","iteración Recursión  Proceso por el cual un método se llama a sí mismo de forma continuada hasta que se llegue a un determinado estado Caso recursivo: El método se invoca a sí mismo Caso base: Permite salir de la recursión   Un método recursivo debe tener al menos un caso recursivo y al menos un caso base El caso recursivo debe aproximarse al caso base   Los métodos recursivos utilizan sentencias más sencillas para simplificar problemas complejos  Ejemplo 1: Sumatorio de 1 a n (con n > 0) public static long s (int n){          if (n==1){         return 1;     }     else{         return s(n-1)+n;     } }   Caso base Caso recursivo  Ejemplo 2: Recursión mal diseñada* public static long s (int n){          if (n==1){         return 1;     }     else{         return s(n+1)+n;     } }   Caso base Caso recursivo (si n > 1)  Ejemplo 3: Sumatorio de n a 1000 public static long s (int n){          if (n==1000){         return 1000;     }     else if (n>1000){         return 0;     }     else{         return s(n+1)+n;     } }   Casos base Caso recursivo  Ejemplo 4: Cuenta atrás (con contador > 0) public static void cuentaAtras(int contador){     if(contador == 0){         return;     }     else{         System.out.println(contador+"" "");         cuentaAtras(--contador);         return;     } }   Caso base Caso recursivo  Ejercicio 1  Implementa el método recursivo square(int n), el cual permite calcular el cuadrado de n (cuando n > 1)iteración  Contenidos Proceso por el cual un método se llama a sí mismo de forma continuada hasta que se llegue a un determinado estado    Caso recursivo: El método se invoca a sí mismo   Caso base: Permite salir de la recursiónUn método recursivo debe tener al menos un caso recursivo y al menos un caso baseEl caso recursivo debe aproximarse al caso baseLos métodos recursivos utilizan sentencias más sencillas para simplificar problemas complejos  Recursión Sumatorio de 1 a n (con n > 0) Ejemplo 1 public static long s (int n){         if (n==1){       return 1;    }    else{       return s(n-1)+n;    } }   Caso base Caso recursivo  ❚ s(3) =❚ s(2)+3 =❚ (s(1)+2)+3 =❚ (1+2)+3 =❚ (3+3)=❚ 6 El caso recursivo sucede dos veces => s(3) y s(2)El caso base sucede una vez => s(1)   Recursión mal diseñada* Ejemplo 2 public static long s (int n){         if (n==1){       return 1;    }    else{       return s(n+1)+n;    } }   Caso base Caso recursivo  (si n > 1) El caso recursivo sucede “infinitas” vecesEl caso base no sucede nuncaStackOverflowError (desbordamiento de la pila de memoria)❚ s(3) =❚ s(4)+3 =❚ (s(5)+4)+3 =❚ ((s(6)+5)+4)+3 =❚ (((s(7)+6)+5)+4)+3 =❚ ...❚ No termina Sumatorio de n a 1000 Ejemplo 3 public static long s (int n){         if (n==1000){       return 1000;    }    else if (n>1000){       return 0;    }    else{       return s(n+1)+n;    } }   Casos base Caso recursivo  Cuenta atrás (con contador > 0) Ejemplo 4 public static void cuentaAtras(int contador){    if(contador == 0){       return;    }    else{       System.out.println(contador+"" "");       cuentaAtras(--contador);       return;    } }   Caso base Caso recursivo  Ejercicio 1 Implementa el método recursivo square(int n), el cual permite calcular el cuadrado de n (cuando n > 1)return método(n, método(n-1)); Recursión en cascada: Fibonacci Serie de Fibonacci (con n > 0) public static long fib(int n){    if (n<=1){       return 1;    }    else{       return fib(n-1)+fib(n-2);    } }  Conversión a recursión lineal de Fibonacci public static long fibo(int n, int x, int y){    if (n<=1){       return x+y;    }    else {       return fibo(n-1, y, x+y);    } }      public static long fib (int n){    return fibo(n,0,1); }  Recursión anidada: Morris public static int mor(int n, int m){    if (n==m){       return (m+1);    }    else{       return(mor(n, mor(n-1, m+1)));    } }  ❚ mor(4,0) =❚ mor(4, mor(3,1)) =❚ mor(4, mor(3, mor(2,2)) =❚ mor(4, mor(3,3)) =❚ mor(4,4) =❚ 5 Ejercicio 3 Implementa el método recursivo a(int m, int n) que permite calcular la función de Ackermann-Péter tal y como se define a continuación: Recursión mutua public static boolean par(int n){    if (n==0){       return true;    }    else{       return impar(n-1);    } }      public static boolean impar(int n){    if (n==0){       return false;    }    else{       return par(n-1);    } }  La recursión lineal por la cola se puede convertir de forma inmediata en iteración (bucle) Para otras formas de recursión se requieren técnicas de transformación de programas y posiblemente estructuras de datos más complejas. Recursión vs. Iteración “The transformation from recursion to iteration is one of the most fundamental concepts of computer science.” D.Entonces comienza el calculo del resultado final  Computacionalmente costoso  “Recursión por la cola” (tail recursion)  El resultado final se obtiene al llegar al caso base (uso de un acumulador)  Menor coste computacional  Recursión no lineal  Varias llamadas recursivas por caso recursivo Recursión en cascada P.ej. return método(n) + método(n-1); Recursión anidada P.ej.Iteración   La recursión lineal por la cola se puede convertir de forma inmediata en iteración (bucle).  Para otras formas de recursión se requieren técnicas de transformación de programas y posiblemente estructuras de datos más complejas.   Resumen  Identificar el rango de valores para terminación Caso(s) base y caso(s) recursivos que se aproximan al base Recursión lineal (máx. 1 llamada recursiva por rama) Por la cola (resultado en la última operación y fácilmente convertible a bucle) No por la cola (cálculo costoso)   Recursión no lineal (más de 1 llamada recursiva en alguna rama) Cascada o anidada.","19:42:19 - 06/02/2025"
"CharlieBOT","¡Claro! La recursividad es un proceso en el que un método se llama a sí mismo de forma continua hasta que se llega a un determinado estado. En Java, un método recursivo debe tener al menos un caso recursivo y al menos un caso base. El caso recursivo se invoca a sí mismo y el caso base permite salir de la recursión. Un ejemplo sencillo de recursión en Java es el cálculo del sumatorio de 1 a n (con n > 0). Aquí tienes un ejemplo de un método recursivo para calcular el sumatorio: public static long s (int n){         if (n==1){       return 1;    }    else{       return s(n-1)+n;    } }  En este ejemplo, el caso base es cuando n es igual a 1, y el caso recursivo es cuando n es mayor que 1. El método se llama a sí mismo con un valor menor en cada iteración hasta que se alcanza el caso base. ¿Te gustaría que te explicara este ejemplo con más detalle o necesitas ayuda con otro concepto de la recursividad en Java?","19:42:31 - 06/02/2025"
"User","Tengo el siguiente código, pero no funciona. ¿Está mal? public static int fac(int n) { return n*fac(n-1); }","19:42:56 - 06/02/2025"
"semantic_search","Knuth, 1974 Cálculo del factorial fac(n) = n! = n*(n-1)(n-2)…21  (con n > 0 y m = 1) public static long fac(int n, int m){    if (n<=1){       return m;    }     else{       return fac(n-1, n*m);    } }  public static long fac(int n, int m){     while (! (n <= 1)){         m = n * m;         n = n - 1;     }     return m; }  RecursiónIteración Ejercicio 4 Implementa el método recursivo mcd(int a, int b) el cual permite calcular el máximo común divisor de dos números enteros. Ejercicio 5 Implementa el método recursivo decToBin(int decimal, String binary) el cual recibe un número decimal y devuelve una cadena con el equivalente en binario de dicho número decimal. Resumen  Identificar el rango de valores para terminación Caso(s) base y caso(s) recursivos que se aproximan al base Recursión lineal (máx. 1 llamada recursiva por rama) Por la cola (resultado en la última operación y fácilmente convertible a bucle) No por la cola (cálculo costoso)   Recursión no lineal (más de 1 llamada recursiva en alguna rama) Cascada o anidada","19:42:56 - 06/02/2025"
"CharlieBOT","Sí, el código que has proporcionado tiene un problema. El método fac que has escrito no tiene un caso base que permita salir de la recursión. En la implementación que has mostrado, el método se llamará a sí mismo de forma indefinida, lo que provocará un desbordamiento de pila (stack overflow) ya que no hay una condición que detenga la recursión. Para calcular el factorial de un número de forma recursiva en Java, necesitas un caso base que detenga la recursión. Aquí tienes un ejemplo corregido de cómo podrías implementar el cálculo del factorial de forma recursiva: public static int fac(int n) {    if (n <= 1) {       return 1;    } else {       return n * fac(n-1);    } }  En este ejemplo, el caso base es cuando n es menor o igual a 1, y el caso recursivo es cuando n es mayor que 1. De esta manera, la recursión se detiene cuando n alcanza el valor de 1. Espero que esta explicación te ayude a comprender cómo implementar la recursividad para calcular el factorial en Java. Si tienes alguna otra pregunta o necesitas más ayuda, no dudes en preguntar.","19:42:59 - 06/02/2025"
"User","¿Qué debo tener en cuenta al escribir métodos recursivos?","19:43:24 - 06/02/2025"
"semantic_search","","19:43:24 - 06/02/2025"
"CharlieBOT","Al escribir métodos recursivos en Java, es importante tener en cuenta varios aspectos para asegurarte de que la recursión funcione correctamente:  Caso base: Debes asegurarte de tener al menos un caso base que permita salir de la recursión. Sin un caso base, la recursión continuará indefinidamente, lo que puede provocar un desbordamiento de pila.  Progreso hacia el caso base: Cada llamada recursiva debe acercarse al caso base en cada iteración. De lo contrario, la recursión no terminará y se producirá un desbordamiento de pila.  Gestión de los parámetros: Asegúrate de que los parámetros pasados a las llamadas recursivas se actualicen de manera que la recursión avance hacia el caso base. Si los parámetros no se actualizan correctamente, la recursión puede no terminar.  Eficiencia: Aunque la recursión es una técnica poderosa, en algunos casos puede ser menos eficiente que un enfoque iterativo. Debes considerar la eficiencia de tu algoritmo y evaluar si la recursión es la mejor opción en términos de uso de memoria y tiempo de ejecución.   Al tener en cuenta estos aspectos al escribir métodos recursivos, podrás evitar errores comunes y asegurarte de que la recursión funcione correctamente en tus programas. Si tienes más preguntas sobre la recursividad en Java o necesitas ayuda con algún otro concepto, no dudes en preguntar.","19:43:27 - 06/02/2025"
"User","Basándote en la conversación anterior, hazme preguntas para ver si he entendido. Respóndeme dándome consejos.","19:44:49 - 06/02/2025"
"semantic_search","","19:44:49 - 06/02/2025"
"CharlieBOT","Claro, estaré encantado de ayudarte a comprobar si has entendido los conceptos sobre la escritura de métodos recursivos. Aquí tienes algunas preguntas para evaluar tu comprensión:  ¿Por qué es importante tener un caso base en un método recursivo? ¿Qué significa ""progreso hacia el caso base"" en el contexto de la recursión? ¿Qué aspectos debes considerar al gestionar los parámetros en un método recursivo? ¿Por qué es importante evaluar la eficiencia al elegir entre un enfoque recursivo o iterativo?  Una vez que hayas respondido a estas preguntas, estaré encantado de darte consejos y retroalimentación sobre tus respuestas. ¡Adelante!","19:44:52 - 06/02/2025"
"User","Claro, el caso base, que ya lo hemos visto.    Que tiene que haber una progresión hacia el caso base.    Casos particulares, tenerlos en cuenta.    La eficiencia, que en la recursión sabemos que puede ser mala.","19:45:38 - 06/02/2025"
"semantic_search","iteración Recursión  Proceso por el cual un método se llama a sí mismo de forma continuada hasta que se llegue a un determinado estado Caso recursivo: El método se invoca a sí mismo Caso base: Permite salir de la recursión   Un método recursivo debe tener al menos un caso recursivo y al menos un caso base El caso recursivo debe aproximarse al caso base   Los métodos recursivos utilizan sentencias más sencillas para simplificar problemas complejos  Ejemplo 1: Sumatorio de 1 a n (con n > 0) public static long s (int n){          if (n==1){         return 1;     }     else{         return s(n-1)+n;     } }   Caso base Caso recursivo  Ejemplo 2: Recursión mal diseñada* public static long s (int n){          if (n==1){         return 1;     }     else{         return s(n+1)+n;     } }   Caso base Caso recursivo (si n > 1)  Ejemplo 3: Sumatorio de n a 1000 public static long s (int n){          if (n==1000){         return 1000;     }     else if (n>1000){         return 0;     }     else{         return s(n+1)+n;     } }   Casos base Caso recursivo  Ejemplo 4: Cuenta atrás (con contador > 0) public static void cuentaAtras(int contador){     if(contador == 0){         return;     }     else{         System.out.println(contador+"" "");         cuentaAtras(--contador);         return;     } }   Caso base Caso recursivo  Ejercicio 1  Implementa el método recursivo square(int n), el cual permite calcular el cuadrado de n (cuando n > 1)Entonces comienza el calculo del resultado final  Computacionalmente costoso “Recursión por la cola” (tail recursion) El resultado final se obtiene al llegar al caso base (uso de un acumulador) Menor coste computacional   Recursión no lineal  Varias llamadas recursivas por caso recursivo Recursión en cascada P.ej. return método(n) + método(n-1); Recursión anidada P.ej.iteración    Contenidos Proceso por el cual un método se llama a sí mismo de forma continuada hasta que se llegue a un determinado estado    Caso recursivo: El método se invoca a sí mismo   Caso base: Permite salir de la recursiónUn método recursivo debe tener al menos un caso recursivo y al menos un caso baseEl caso recursivo debe aproximarse al caso baseLos métodos recursivos utilizan sentencias más sencillas para simplificar problemas complejos  Recursión Sumatorio de 1 a n (con n > 0) Ejemplo 1 public static long s (int n){         if (n==1){       return 1;    }    else{       return s(n-1)+n;    } }   Caso base Caso recursivo  ❚ s(3) =❚ s(2)+3 =❚ (s(1)+2)+3 =❚ (1+2)+3 =❚ (3+3)=❚ 6 El caso recursivo sucede dos veces => s(3) y s(2)El caso base sucede una vez => s(1)   Recursión mal diseñada* Ejemplo 2 public static long s (int n){         if (n==1){       return 1;    }    else{       return s(n+1)+n;    } }   Caso base Caso recursivo  (si n > 1) El caso recursivo sucede “infinitas” vecesEl caso base no sucede nuncaStackOverflowError (desbordamiento de la pila de memoria)❚ s(3) =❚ s(4)+3 =❚ (s(5)+4)+3 =❚ ((s(6)+5)+4)+3 =❚ (((s(7)+6)+5)+4)+3 =❚ ...❚ No termina Sumatorio de n a 1000 Ejemplo 3 public static long s (int n){         if (n==1000){       return 1000;    }    else if (n>1000){       return 0;    }    else{       return s(n+1)+n;    } }   Casos base Caso recursivo  Cuenta atrás (con contador > 0) Ejemplo 4 public static void cuentaAtras(int contador){    if(contador == 0){       return;    }    else{       System.out.println(contador+"" "");       cuentaAtras(--contador);       return;    } }   Caso base Caso recursivo  Ejercicio 1 Implementa el método recursivo square(int n), el cual permite calcular el cuadrado de n (cuando n > 1)¿Cuántas veces se ejecuta el caso recursivo y el caso base al llamar a riddle(3,5) y cuál es el valor de retorno? Tipos de recursión  Recursión lineal  Máximo una llamada recursiva por caso recursivo “Recursión no por la cola” (non-tail recursion) Hay que llegar al caso base para obtener el primer resultado.Iteración   La recursión lineal por la cola se puede convertir de forma inmediata en iteración (bucle).  Para otras formas de recursión se requieren técnicas de transformación de programas y posiblemente estructuras de datos más complejas.   Resumen  Identificar el rango de valores para terminación Caso(s) base y caso(s) recursivos que se aproximan al base Recursión lineal (máx. 1 llamada recursiva por rama) Por la cola (resultado en la última operación y fácilmente convertible a bucle) No por la cola (cálculo costoso)   Recursión no lineal (más de 1 llamada recursiva en alguna rama) Cascada o anidada.","19:45:38 - 06/02/2025"
"CharlieBOT","¡Excelente! Parece que has entendido bien los conceptos clave sobre la escritura de métodos recursivos. Aquí tienes algunos consejos basados en tus respuestas:  Caso base: Es fundamental tener un caso base que permita salir de la recursión. Asegúrate de que el caso base se cumpla claramente y de que la recursión se detenga cuando se alcance este caso.  Progreso hacia el caso base: Es importante que cada llamada recursiva se acerque al caso base en cada iteración. Asegúrate de que el progreso hacia el caso base esté presente en tu lógica recursiva para evitar bucles infinitos.  Gestión de los parámetros: Considera cuidadosamente cómo se gestionan los parámetros en las llamadas recursivas. Asegúrate de que los parámetros se actualicen de manera que la recursión avance hacia el caso base.  Eficiencia: Es cierto que la recursión puede ser menos eficiente en algunos casos. Antes de elegir un enfoque recursivo, evalúa la eficiencia de tu algoritmo y considera si la recursión es la mejor opción en términos de uso de memoria y tiempo de ejecución.   ¡Sigue practicando la escritura de métodos recursivos y estarás en el buen camino! Si tienes más preguntas o necesitas más ayuda, no dudes en preguntar.","19:45:41 - 06/02/2025"
"User","Sobre la base de la conversación anterior, quiero que me haga una pregunta de respuesta múltiple para ver si lo he entendido. Las afirmaciones son: A. El caso base es opcional.  B. Cada llamada recursiva debe llevar a una progresión hacia el caso base. Eso es correcto, la primera no. C. Los métodos recursivos son siempre más eficientes que los métodos iterativos. Es también incorrecto. D. los métodos recursivos no necesitan test en profundidad porque siguen un modelo predecible.","19:47:12 - 06/02/2025"
"semantic_search","","19:47:12 - 06/02/2025"
"CharlieBOT","Claro, aquí tienes tu pregunta de respuesta múltiple: ¿Cuáles de las siguientes afirmaciones son correctas? A. El caso base es opcional.B. Cada llamada recursiva debe llevar a una progresión hacia el caso base.C. Los métodos recursivos son siempre más eficientes que los métodos iterativos.D. Los métodos recursivos no necesitan test en profundidad porque siguen un modelo predecible. Por favor, selecciona todas las opciones que consideres correctas y luego te daré retroalimentación sobre tus respuestas.","19:47:21 - 06/02/2025"
"User","B","19:47:30 - 06/02/2025"
"semantic_search","","19:47:30 - 06/02/2025"
"CharlieBOT","Perfecto, veamos tus respuestas: A. El caso base es opcional.Incorrecto. El caso base es fundamental en la recursión, ya que permite que la función recursiva se detenga en algún momento. B. Cada llamada recursiva debe llevar a una progresión hacia el caso base.Correcto. Cada llamada recursiva debe acercarse al caso base en cada iteración para evitar bucles infinitos. C. Los métodos recursivos son siempre más eficientes que los métodos iterativos.Incorrecto. Los métodos recursivos no son siempre más eficientes que los métodos iterativos. En algunos casos, la recursión puede ser menos eficiente en términos de uso de memoria y tiempo de ejecución. D. Los métodos recursivos no necesitan test en profundidad porque siguen un modelo predecible.Incorrecto. Los métodos recursivos también necesitan ser probados en profundidad, ya que pueden tener errores lógicos o de implementación. ¡Has acertado en la afirmación B! Sin embargo, las afirmaciones A, C y D son incorrectas. Recuerda que el caso base es fundamental, la eficiencia de la recursión puede variar y los métodos recursivos también necesitan ser probados exhaustivamente. Si tienes más preguntas o necesitas aclaraciones adicionales, no dudes en preguntar.","19:47:43 - 06/02/2025"
"User","d","19:47:59 - 06/02/2025"
"semantic_search","","19:47:59 - 06/02/2025"
"CharlieBOT","La opción D es incorrecta. Los métodos recursivos también necesitan ser probados en profundidad, ya que pueden tener errores lógicos o de implementación. La recursión no garantiza que el código sea completamente predecible y libre de errores. Si tienes más preguntas o necesitas aclaraciones adicionales, no dudes en preguntar.","19:48:00 - 06/02/2025"

