Id;Role;Message;Datetime;Classification;Topic;Change;AI - 4%
GpQaH0Aw7AfNYfO;User;"Dado el método void reduceFraction(int numerator, int denominator), que imprime el resultado de una fracción reducida a partir del numerador (numerator) y denominador (denominator) de una fracción pasados como argumentos. Indica cuales serían dos ejemplos válidos de dos clases de equivalencia distintas. El método funciona de la siguiente manera: si pasamos como numerador 2 y como denominador 10, debería imprimir la fracción simplificada ""1/5"". Por otro lado, si pasamos como numerador 1 y como denominador 3, debería imprimir la fracción simplificada ""1/3"", porque no se puede simplificar más. a. numerator1 = 2, denominator1= 5, y numerator2 = 3, denominator2= 6; *** b. numerator1 = 2, denominator2= 5, y numerator2 = 5, denominator2= 2; c. numerator1 = 2, denominator2= 5, y numerator2 = 7, denominator2= 3; d. numerator1 = 1, denominator2= 5, y numerator2 = 7, denominator2= 3;";16:44:39 - 12/06/2024;Multiple Question Exercise;Testing;No;Yes
GpQaH0Aw7AfNYfO;semantic_search;;16:44:39 - 12/06/2024;;;;
GpQaH0Aw7AfNYfO;CharlieBOT;"Los ejemplos válidos de dos clases de equivalencia distintas para el método reduceFraction podrían ser:  Ejemplo 1:  Numerador 1: 2 Denominador 1: 5 Resultado esperado: ""2/5""   Ejemplo 2:  Numerador 2: 3 Denominador 2: 6 Resultado esperado: ""1/2""    Estos dos ejemplos representan clases de equivalencia distintas ya que el primer ejemplo representa una fracción irreducible, mientras que el segundo ejemplo representa una fracción que puede ser reducida. Espero que esta información te sea de ayuda. Si necesitas algo más, no dudes en preguntar.";16:44:41 - 12/06/2024;;;;
GpQaH0Aw7AfNYfO;User;que hace el metodo Math.max;17:07:28 - 12/06/2024;Conceptual Questions;Java;Yes;Yes
GpQaH0Aw7AfNYfO;semantic_search;;17:07:28 - 12/06/2024;;;;
GpQaH0Aw7AfNYfO;CharlieBOT;El método Math.max en Java se utiliza para obtener el valor máximo entre dos o más números. Este método toma dos parámetros y devuelve el valor más grande de los dos. Por ejemplo, si llamamos a Math.max(5, 10), el método devolverá 10, que es el valor más grande entre 5 y 10. Si necesitas más información o ejemplos, no dudes en preguntar.;17:07:30 - 12/06/2024;;;;