Id;Role;Message;Datetime;Classification;Topic;Change;AI - 11%
lpnn8Ea2LonQbUj;User;Siendo a un árbol binario de búsqueda de claves enteras y vacío. ¿Cual es la altura final del árbol si se insertan nodos con la siguiente secuencia de claves? 1,2,3,4,5,6,7?;08:33:04 - 29/05/2024;Conceptual Questions;Data Structures;No;Yes
lpnn8Ea2LonQbUj;semantic_search;"Estructura de un libro o documento Definición no recursiva Un árbol consiste en un conjunto de nodos y un conjunto de aristas, de forma que:  Se distingue un nodo llamado raíz A cada nodo h (hijo), excepto la raíz, le llega una arista de otro nodo p (padre) Para cada nodo hay un camino (secuencia de aristas) único desde la raíz. Los nodos que no tienen hijos se denominan hojas  Definición recursiva Un árbol es:  Vacío O un nodo raíz y cero o más árboles (subárboles) conectados al nodo mediante una arista a la raíz  A los árboles que se conectan al nodo raíz los denominaremos también ""subárboles"" Terminología  Un nodo es externo, si no tiene hijos (es hoja) Un nodo es interno, si tiene uno o más hijos Un nodo es ascendiente de otro, si es padre de él o ascendiente de su padre. Un nodo es descendiente de otro, si este último es ascendiente del primero Un camino de un nodo a otro es una secuencia de aristas consecutivas que llevan del primero al segundo La profundidad de un nodo es la longitud del camino de la raíz a ese nodo La altura de un árbol es el valor de la profundidad del nodo más profundo El tamaño de un árbol es el número de nodos que contiene  Árboles binarios de búsqueda Un árbol binario de búsqueda es un árbol binario en el que para cada nodo n:  Todas las claves de los nodos del subárbol izquierdo son menores que la clave de n Y todas las del subárbol derecho mayores.  Montículos (heaps) Un montículo (binario) es un árbol binario completo en el que cada nodo tiene una clave mayor(*) que la de su padre (min-heap). Aplicaciones:  Colas con prioridad Ordenación (Heap Sort)  Ejercicios 1.Crespo García, Carlos Delgado Kloos, Mª Carmen Fernández Panadero, Julio Villena Román Contenidos  Concepto de árbol Terminología Implementación Casos especiales Árboles binarios de búsqueda Montículos (heaps)    Concepto de árbol Un árbol es una estructura de datos no lineal que almacena los elementos jerárquicamente (generalización de las listas). Ejemplos  Clasificación de la información en una enciclopedia Sistema de ficheros Estructura organizativa de una empresa Estructura de rangos del ejército";08:33:04 - 29/05/2024;;;;
lpnn8Ea2LonQbUj;CharlieBOT;Para calcular la altura final del árbol después de insertar los nodos con la secuencia de claves dada, podemos seguir los siguientes pasos:  Comenzamos con un árbol vacío. Insertamos los nodos con las claves en el orden dado: 1, 2, 3, 4, 5, 6, 7. Calculamos la altura del árbol resultante.  Dado que estamos insertando los nodos en orden ascendente, el árbol resultante será un árbol completamente desbalanceado, con una altura igual al número de nodos menos uno. Por lo tanto, la altura final del árbol después de insertar los nodos con la secuencia de claves 1, 2, 3, 4, 5, 6, 7 será de 6. Espero que esta información te sea de ayuda. Si tienes alguna otra pregunta relacionada con sistemas de programación, no dudes en preguntar.;08:33:07 - 29/05/2024;;;;
lpnn8Ea2LonQbUj;User;no lo entiendo;08:33:42 - 29/05/2024;Uncategorized;Data Structures;No;Yes
lpnn8Ea2LonQbUj;semantic_search;;08:33:42 - 29/05/2024;;;;
lpnn8Ea2LonQbUj;CharlieBOT;Voy a explicarlo de otra manera. Cuando insertamos los nodos en un árbol binario de búsqueda, la altura del árbol depende del orden en que se insertan los nodos. En este caso, al insertar los nodos con las claves 1, 2, 3, 4, 5, 6, 7 en ese orden, el árbol resultante será desbalanceado, con una altura igual al número de nodos menos uno. Dado que estamos insertando 7 nodos, la altura final del árbol será de 6. Espero que esta explicación sea más clara. Si tienes alguna otra pregunta o necesitas más aclaraciones, no dudes en preguntar.;08:33:45 - 29/05/2024;;;;